{
  "$schema": "https://json-schema.org/draft/2020-12/schema",
  "$id": "https://claire-de-binare/docs/contracts/profitability_scenario_stress_summary.v1.schema.json",
  "title": "Profitability Scenario Stress Summary v1",
  "type": "object",
  "additionalProperties": false,
  "required": [
    "schema_version",
    "stress_summary_id",
    "candidate_id",
    "catalog_id",
    "generated_at",
    "overall_stress_outcome",
    "scenario_results",
    "recommendation_impact",
    "limitations"
  ],
  "properties": {
    "schema_version": {
      "const": "profitability_scenario_stress_summary.v1"
    },
    "stress_summary_id": {
      "type": "string",
      "pattern": "^pss-[a-z0-9_-]{6,64}$"
    },
    "candidate_id": {
      "type": "string",
      "pattern": "^cand-[a-z0-9_-]{4,64}$"
    },
    "catalog_id": {
      "type": "string",
      "pattern": "^psc-[a-z0-9_-]{6,64}$"
    },
    "generated_at": {
      "type": "string",
      "format": "date-time"
    },
    "overall_stress_outcome": {
      "type": "string",
      "enum": ["PASS", "WARNING", "FAIL", "BLOCKED"]
    },
    "scenario_results": {
      "type": "array",
      "minItems": 1,
      "items": {
        "type": "object",
        "additionalProperties": false,
        "required": [
          "scenario_id",
          "domain",
          "severity",
          "status",
          "net_return_delta",
          "max_drawdown_delta",
          "impact_summary"
        ],
        "properties": {
          "scenario_id": {
            "type": "string",
            "pattern": "^[a-z0-9_]{3,64}$"
          },
          "domain": {
            "type": "string",
            "enum": [
              "SLIPPAGE",
              "SPREAD",
              "PARTIAL_FILL",
              "REJECTION",
              "LATENCY",
              "FEED_GAP",
              "VOLATILITY",
              "LIQUIDITY"
            ]
          },
          "severity": {
            "type": "string",
            "enum": ["BASELINE", "LOW", "MEDIUM", "HIGH"]
          },
          "status": {
            "type": "string",
            "enum": ["PASS", "WARNING", "FAIL", "BLOCKED", "NOT_RUN"]
          },
          "net_return_delta": {
            "oneOf": [
              {
                "type": "null"
              },
              {
                "type": "number"
              }
            ]
          },
          "max_drawdown_delta": {
            "oneOf": [
              {
                "type": "null"
              },
              {
                "type": "number"
              }
            ]
          },
          "impact_summary": {
            "type": "string",
            "minLength": 1
          },
          "requires_followup_issue": {
            "type": "boolean"
          }
        }
      }
    },
    "recommendation_impact": {
      "type": "object",
      "additionalProperties": false,
      "required": [
        "promote_allowed",
        "park_required",
        "reject_required",
        "notes"
      ],
      "properties": {
        "promote_allowed": {
          "type": "boolean"
        },
        "park_required": {
          "type": "boolean"
        },
        "reject_required": {
          "type": "boolean"
        },
        "notes": {
          "type": "string",
          "minLength": 1
        }
      }
    },
    "limitations": {
      "type": "array",
      "minItems": 1,
      "items": {
        "type": "string",
        "minLength": 1
      }
    }
  }
}
